class,screen_name,description,name,statuses_count,followers_count,friends_count,ID
y,@Nurse_surfing,"A baby boomer RN with many great years nursing experience in leader and staff roles, now a Sr. Nurse Recruiter; I'm one step ahead in meeting customers needs!",Liz Beattie,241,765,2172,2469923516
y,@AdvPracPrep,"Join us for Skills & Procedures Workshops! Nurse Practitioners, Physicians, Physician Assistants, ALL students welcome. Check our website to find class near you",AdvancedPracticePrep,238,765,4459,3837391936
y,@IcyCosplay,"Nurse, Costume designer and model",Icy,474,764,81,2357296046
n,@FeistySnowflake,"[__]_ __ Play with fire, it will burn you_ | Daughter of a war vet and a nurse and sister of @BuckyBarnes1917. @BabyBarnesR is my little angel ||___#MCURP.|#MV.___",On  hiatus,1926,764,1376,3345159131
y,@ginah89121,Retired Nurse just changed my affiliation to Republican TRUMP all the way to the WH. Tired of the Establishment & the libtards. TROLLS BLOCKED,Gina H Las Vegas,16297,761,81,3420540252
y,@Strax_Sontaran,"I am Sontaran Commander Strax! Key member of the Paternoster Gang, founder of The Time Gang, nurse, warrior and butler. I solve crimes. May I take your coat?",Commander Strax,3116,759,1188,2873995022
y,@elizabeth27ann,"Christian, conservative, single mother, Registered Nurse, vocalist, photographer, avid reader, movie lover, and PROUD AMERICAN PATRIOT! GOD, FAMILY, COUNTRY.",elizabeth,2928,756,683,2369588052
y,@ICU_gypsynurse,"Traveling the country, one hospital at a time",ICU Gypsy Nurse,2209,755,394,2925642839
y,@naibaho_siagian,"i'm a nurse II Orang Tua , inspirasi di hari tua ku nanti :)|folback just menstion | 17.06.1995 (_)`) pin : 59B3B392 tebing-tinggi sumatra utara",Juni andho Naibaho __,28654,754,204,2531473950
n,@_BriAntwanette,You can go by what you heard depending on what they told you. Graduate of 2015  Future Nurse,August 22 __,3065,753,1480,2582868663
y,@littleworldbeka,Beka | Mental health nurse blogging her way through life | #TheGirlGang | instagram - littleworldofbeka | bekatheaker@hotmail.co.uk Derbyshire/Leeds. xo,Beka Louise,9229,753,372,2895797259
n,@heartbreakseven,everything happens for a reason / New York/ future nurse,heartbreakseven,3352,753,628,3051435988
y,@LightenedWinter,_Stand for something or fall for anything__ | Nurse & sister of Bucky. I guess you can say my family's cursed || Single || [#MarvelRP _ MV _ Detailed],Rebecca Barnes,3191,752,1242,3174485969
y,@aduseijennifer1,"just love to take care of people/ nurse , member of the PP HYPE CREW",Papabi _PpHypecrew,11952,752,611,3244964458
y,@andrew_bogg,"new account but same old me, 40 odd year old just making the most of life. Nurse, real ale fan and loves a laugh!",andrew bogg,17851,751,1148,2731633078
n,@AverageAnonMiss,_ Avi Is Not Me _ Future Nurse _ Taken _ HS senior _ 18 _ Twin&Twitter BFF is @stellarbabee_ _ est. 11.8.2014 _,Average AnonyMiss,614,747,344,2893024741
y,@MattmMurdockDD,"i am Matt Murdock a Hell's Kitchen lawyer by day, justice by night i am DD(Rp 18+)Team:Avengers Lover:@E_Natchios__,Friends:Night Nurse,The Punisher,and Ant-Man",Matt Murdock(DD),647,747,1411,3290807787
n,@iamsarahfix,a future nurse | IG: sarahfix96,Sarah.,2594,746,312,2469753673
n,@4angel4ever88,"Hi
 I am a mother, wife, and retired nurse! I enjoy twitter, luv messaging with positive people! Most of all I'm a THERESA and LARRY CAPUTO'S FAN!",Mary Ann Mann,28718,746,323,2635595337
y,@johnhan79583770,"Nurse, Bachelors in Health Care Adm.",john hancock,10646,746,643,3398766433
y,@HSam_Christina,"Personal Nurse&Therapist/Dental Assistant/Future Transcriptionist Beautiful,sweet-Inside&Outside;Gurl*X LUV U guys!#BlackMafia", Heidi Samantha,1835,745,1709,2765227829
n,@Gravydog316,COLD Canadian; future nurse; wannabe wrestler & nude model lol jk,Sarah Brandy Peters,378,743,1214,2788789957
y,@Ironcladirish,Conservative #NRA Retired Nurse #2A #1A #PJNET #OiP CATHOLIC- Family Love OUR USA- God- Patriot  #UnitedWeStand /Dad WAS POW /BOTB/ WW2- Nephew KIA #IRAQ #ORPUW,Corin Morgan-Ryan,2256,743,722,3413037424
y,@JustJaneUK,"walking dead, Boondock Saints, Hello Herman,Andy LIncoln, Norman Reedus, Jon Bernthal. Mum of 3 and full time carer. Former nurse,Bookworm and cat lover.",Jane,8028,742,628,3314698433
n,@jobfindlynur,"View all available Nurse jobs from company sites, job boards and the web at http://jobfindly.com - thousands of new jobs added daily!",Nursing Jobs,59787,742,4831,4658448912
y,@TheBabyfriend,"Horse whispering, Maternity Nurse, Babycare Expert, Writer and Blogger, Criminal Minds Fan, Primal Dieting, Sensible and Silly",Sarah Norris,435,741,774,2989712604
n,@WeekndsNear,athlete | god first | future nurse/children's doctor | in love with the success. | ofwgkta .,__ felica the goat.,1103,739,1251,2900608938
y,@DiAngelina917,Author of Contemporary Romance Novel with seductively sassy scenes. I am a retired nurse who is starting a new chapter in life as an aspiring author.,angelina di,2102,739,1208,3119288109
y,@RMartine_White,lady Freemason OWF & Student Nurse. Student Quality Ambassador. RCN Information Officer. Committee member for RAF Cadets & Royal Navy Sea Cadets.,Reanne Martine White,586,738,2010,2744445353
y,@shimmer_angel,"Future nurse | Class, ass, and a whole lot of sass | header is mine| East Coast",Not cute just psycho,2907,737,782,3320314575
n,@citicorpgroup,"Ex-spanish soap star, work on Law & Order SVU, Blacklists, Nurse Jackie, Elementary, and various indie film.J.D. in law, Ex-U.S.Marine Lt.Colonel,33rd mason.","Isaiah Eli,Actor/Law",1479,734,1948,2995220152
y,@rubyredlips78,"Registered General Nurse/ juice plus user  vintage, fashion and beauty lover. Health and Happiness",__Rachael Adams,977,733,1977,3034946710
n,@ForeverKaee_,Kaee__Chicago __Aries__Future Nurse,__akayla Ren'ee,25824,730,538,2376204242
y,@tseracing1,"God Bless You!!Mother. Nurse. Student. Reedus, Rooker, and Flanery lover. I' m a reader and writer. Life is So Good :) #TWD. #BoondockSaints #HarleyQuinn",Krissyg927,3104,728,1290,2470544553
y,@mommybrief,Official Twitter for http://MommyBrief.com #Mommy. Wife. CEO. Cook. Historian. Nurse. Party Planner. Idea Girl. DIYer. Crafter. Teacher. Sci-fi Geek.,The Mommy Brief,585,728,1242,2837719223
n,@PostGridNovel,The authors of Post Grid invite you to read their EMP novel. Nurse and Officer main characters. #1 Best Seller 5 months in a row!,Nancy Martineau,7590,728,2029,3087038606
n,@Mlp_kiwipunch,"A young, fruit loving, pegasus filly who, one day, wants to become a nurse. Always smells like fruit.",Kiwi Punch,12211,728,381,3125109256
y,@Parkin25Marie,"lincolnshire lass. loves vintage. Sherlock,books, animals and a few people. nurse,be nice i choose your catheter size.",Something about Mary,26880,726,567,3222925163
y,@NaturallyGreer,YouTube Natural hair lover and vlogger. Nurse Practitioner by trade,Paula B.,2097,725,916,2724755085
y,@Sarah_ALICE13,Mental Health nurse. Feminist. Animal lover. Avid reader. Northerner (and proud)!,Sarah Alice,11992,725,1445,3150352669
y,@forhananim1,"Christian, husband, father, dog lover, nurse and runner. Oh, and conservative thinker.",Thomas Hamilton,842,723,1123,2500889025
y,@gessellmel,"Psychiatric nurse, mental health therapist, DBT skills group therapy, Facilitator for ASIST Applied Suicide Intervention Skills Training.",Melanie Gessell,2231,722,961,2411398068
y,@nickyNY722,#BuffaloNY #LoveMyLife #Nurse #MusicLover #EyeForFashion,Nick,1170,722,2064,2764600130
y,@KellySaynor,"Specialist Aesthetic Nurse,  NIP and Clinical Lead for Medica Forte, UK's Official distributor of The Perfect Peel.",Kelly Saynor,501,721,983,2463038956
y,@CanadianNursey,23. nurse (obvi). lover of the country music. deathly afraid of clowns. sassier than the average bear.,nurse aurora __,1461,717,1132,3134148890
y,@CarterTreacle,"After 25 years I still think being a nurse is the best job in the world and it is a privilege to get up and be one everyday. Chief Nurse, West Herts.",Tracey Carter,4568,715,476,2369952327
y,@Dhealthynfitu,A proud MUSLIMAH and a NURSE.,Fatima Ibrahim,9,715,1933,2766912315
y,@MaradonaAndre1,"Pinoy nurse ,Prof Pix is mine, enjoying tweet. just wanna have fun....",andre maradona,12803,715,2024,2931543367
n,@GLekovi,"future nurse, boutta save them lives",Gabriela,6050,714,1984,2372949820
y,@ksherfield1,I am a Registered Nurse currently looking for employment. For now I picked up a new hobby called blogging. Follow my page & I will gladly follow yours back ^_^,Katrina Sherfield,1601,714,1015,2806079071
y,@vickymay55,"Bank hating,entitlement believing, animal loving, nurse, photo is ralphie,war loving republicans need not respond",vicky mayer,11616,713,880,2659824072
y,@mbatm2009,"Army medic,Navy Nurse Corps retired CDR, OR director, Navy Surgical Tech School director(past) Sterile Processing Educator, inventor,app creator ,RNMBA",kurk rogers,565,712,1658,2546583827
y,@S_Allsop81,"Hi Twit peeps, I am a gay model/actor / nurse who lives in london, work hard and party harder, live life to the max and try to avoid negativity, please follow",Stephen Allsop,1547,711,1371,2507836041
y,@greentreelcl60,Nurse,Mark Tebbs,127,711,1858,3008472336
n,@_eshaaaaaa,Future Nurse || UWG19 __,esha_,4669,710,899,3068948386
n,@bethhsophia,Student paediatric nurse who takes daily naps and eats pizza. If you don't like the 1975 then we can't be friends.,Beth,11794,709,355,2651430740
y,@HepCBristol,Hepatitis C updates from the @AWPNHS Hepatitis Specialist Nurse for @bdpROADS . Please follow back to help raise awareness of hepatitis C!,HepCBristol,425,708,696,2357115264
y,@Nurse_Muscles,"OR RN, BSN; SFC INARNG; Lifter of heavy things; Married to #SexyNurse @k8_lifts_w8; President of Nurse Muscles LLC; Fitness & Nutrition Consultant","Masen Mills, RN, BSN",42,707,3376,4393349907
y,@protonixpusher,"Hi, I'm your nurse. I'll be your server tonight.
Snapchat: rn.jen",Nurse!,1569,705,96,2433531740
y,@fymyquryqupo,"I am Nurse in canada , love my job and the weather in canada ,",Eald Allsupp,1261,705,1020,2538688932
y,@liveessential1,"God Serving & Fearing. Wife, Mother, Nurse, Nail Technician, Baker/Cake Decorator, Aspiring Entrepreneur & doTerra Wellness Advocate/Essential Oil Specialist.",Katrina Dixon-Parker,2558,704,3654,3320929090
y,@_ivanaglez,Enfermero/Nurse _ GIFs _ Why fit in when you can stand out?,Ivn,7585,703,734,2648836571
y,@LouiseGeraghty5,"Clinical Practice Support Nurse #CCIO 
#HISINM#HOBIC#EHR  #ehealth#passionatecynic #Mum of 2 #clinicalpragmatist #worklifebalance RT not endorsements",Louise Geraghty,430,703,1777,3398408261
n,@musicalbxnes,vocals & guitar in @eyeslike_oceans || tabula rasa || future neonatal nurse practitioner || Matthew 5:16,s h e a,2547,702,2205,2500692225
n,@JoannaDib2,be nice to me .... I may be your   NURSE   someday :),it's Jo-anna,1279,701,861,2386841862
n,@OnlyTay_,|_Married to Cheer _| 18 _ 2016 SENIOR ___ ATL sc:taybae_03 Tre__ Future L&D Nurse,Taylor__,12441,695,693,2358397562
y,@VondaMiller17,Disabled Registered Nurse  Music Video Enthusiast!!! Poet!! Pay Attention To What You Pay Attention To!!!  LOA,Vonda Miller,5864,692,1672,2418283238
n,@THEBitchlnHeels,Nursing student on her way to becoming a Nurse Anesthetist  all while rocking heels and a resting bitch face in the process,THE Bitch In Heels,4775,691,57,2710999610
y,@CatherineHeigl,nurse,Catherine Heigl,362,691,187,2837898259
y,@radenrayanralyn,"prison Nurse.. ediwow..... ___real madrid,,.... __",Radenrayanralyn,18,691,1226,3163631917
n,@FuckinGorgeous3,"#Gemini Cute & Classy!! Future Army Nurse!! Add Me On Snapchat : gemini.cutie
 F.W.A For Lifeee",Yummy Cezzy,7955,690,1124,2732605817
y,@skynyrdinards,"Repentant, Jesus name baptised, Holy Ghost filled child of Jesus Christ.Single,Home Health Nurse,Conservative. Constitution,Small Government, Individual Rights",Kenneth Pitcock,2060,689,998,2928779098
y,@wardamn_rn,"CVICU travel nurse just trying to make it through each night shift. Lover of southern men, food, whiskey, and SEC football. Not necessarily in that order. #WDE",Dixieland Nurse,830,685,577,2743432793
n,@blosxom_,"RINIMC

FEMINIST ___- Sisterhood that empowers not competes. 

Feelings: Drake
Actions: Kanye 

401___

90s baby without a baby 

Scrub nurse in training",Fairy Squad Mother.,4406,683,625,2425991383
y,@MarinaBlack99,Writer. Nurse. Ray of Sunshine. Queen of the Ice Nation. Author of Dealing with the Devil and Unintentionally Yours! Available on Amazon & at local retailers.,Marina Black,3398,682,308,2788209493
y,@BirthTraumaOz,"Trauma therapist,  cred mental health Nurse, Perinatal counsellor, EMDR therapist, Author and Director of The Australian Birth Trauma and PTSD Treatment Centre.",Lindsey Crockett,831,679,1145,2535017935
y,@RightSpirit57,"I'm 58, a Christian - Wife, Mother, Grandma, Nurse, AdvoCare Advisor & a proud member of STEELER NATION http://WWW.ADVOSTARZ.COM",Dee Alexander,1736,679,1667,3004315106
y,@encoretelemed,"Encore Telemedicine specializes in connecting Physicians, Nurse Practitioners, Physicians Assistants and other providers to patients online.",Encore Telemedicine,36,679,676,4487828473
y,@nursedolnick,Home Business Entrepreneur! Registered Nurse! Follow me for Home Business Success!!! Tune in live via periscope!,Janice Dolnick,56,676,2779,2765482014
n,@wozapapulub,"Just me :) 25, student nurse. 3rd year @ DMU. London/Wolverhampton. #teamgreen",Flynn Budgey,1288,675,810,2400711920
y,@sthabile_pkt,Child of God | Jeremiah 29:11| Jesus set me Free | She who Prospers | Student Nurse| The more you don't forgive is the more you delay your breakthrough.,S'thabile Phakathi,1541,674,952,2766772861
y,@AL2Meta0,"I'm a Nurse by profession, but I'm also a Web Designer, Graphics Designer, IT technician and Blogger.

I am currently into fitness. I'm a jack of all trades.",AL Yap,230,674,731,2833196675
y,@boobsnsass,coffee addict _ nurse _ nugget and wine lover,xx,5100,673,335,3255993486
y,@NJScosmetics,"To slow the aging process. Aesthetics practitioner and qualified Nurse carrying out anti-wrinkle treatments, lip augmentation, facial fillers in our clinic",Aesthetics Liverpool,600,672,1092,2828540779
y,@nurseslaughing,"Nurse/Wife/Mom to 1 amazing teen daughter.  I don't believe in judging others, Believes in Faith above all. LGBT ALLY.",Laughing Nurse,1759,672,799,3031943819
y,@BiSlutshy,"ssp:@RoselnRoselyn #only #bi #loyal, cellist, mother, child:@Big_Balloon_Ass, mostly follows back, part time nurse, can be futa,",Octavia C. Melody,3869,672,871,3162744829
y,@Katy_lamb_2,Recovery Nurse ___ Mum Of Four ___ Love God/Family/Friends/Dancing/Music ___ This Is My New Account Replacing @Katy_lamb_ ______,____ Katy ____,2332,672,491,4458636449
y,@i_mmk0107,next ____ sgym nurse,________,30,672,558,4896114528
y,@Calamity_Jayne_,Wigan Warriors & RL fan __ Spinster and Lunatic __ Nurse __ Will always be just a little bit fat. __ Be kind to everyone...including yourself __,Jayne Walsh,9089,671,655,2653986029
n,@zachdrew4,"22, gay, volunteer firefighter, future nurse,coffee addict, & wine enthusiast 
Insta @ZD212 Snapchat and Tumblr @drew-zach",Zach Drew,1371,670,1547,2363855263
y,@HaileyChristy,"Author, avid reader, motorcycle rider, wanderer, nurse, passionate, fierce and loyal to her core.",Christy Hailey,394,669,1521,2381102466
y,@keepnupwitclaud,Edo Nigerian. Aspiring Nurse Practitioner.Psalms 46:5___,.,13869,669,485,2842170905
y,@anne_slam,"Busy exec nurse. Passions - nursing, NHS, reducing inequity, safety, quality, MH & population health. Apprentice mum, novice cook. Tweets not all my own views!",anne,4086,668,1738,2508348721
n,@JeremyWBrown01,17 & Christian | Future @MSU_Nursing Registered Nurse (RN) | #EagleNation & #BBN | Follow me on Instagram @jeremywbrown01,Jeremy Wade Brown,896,668,2553,2731724085
y,@sinead_mehigan,"Academic, nurse, art and food lover. All views my own...",Sinead Mehigan,6132,668,778,2987037027
y,@lulu_twitch,"Things I love: Destiny, Video Games, Vaughn (Kitty), Cookie Dough, Chapstick Addict,  Partnered Twitch Streamer / Registered Nurse

PSN: lulusoccer",Lulusoccer,1065,668,254,3234610438
n,@jaz_zayy,future neonatal nurse._____,jazz__,5467,663,483,3068624396
y,@gracejclarke,"LIBERIAN GIRL__. Graduate Nurse, 05/2014. SUCCESS Drives me. My daughter is my gratest blessing.",LIB__QUEEN,9877,659,340,2670064570
n,@jess_x91,"24, mother, student nurse! ___",Jess,141,659,1520,2741527431
y,@enasharp52,"Retired nurse, out and out Labor supporter,hate the Abbott and Turdball.",Karen,14715,659,767,2849412290
y,@BBC_BJ86,"Full time Mommy, Nurse, Hot Wife, BBC Slut, Bi, lover of redheads! =) Kik: BBC_BJ86",Nurse Joanne,20,657,29,3064291813
n,@BenitoKristen,"kris /
Nurse at HISC /
#auntiebebes",kris,1688,656,473,2358942596
y,@ian_ianrbruce1,"sailor, mental health nurse, lecturer, humanist, listener, socialist all views my own",Ian Robert Bruce,18120,656,843,3243235132
n,@b0740db96d86409,"HI, my name is Emmette Dillon and I am a producer, writer, model, presenter PR executive and also a staff nurse for good measure",Emmette Dillon,2600,655,1975,2984978542
y,@NursesRoar,"Nurse, views are entirely my own. Opposed to loss of student nurse bursaries. Committed to saving our NHS Also follow: https://www.facebook.com/groups/496714360508822/",Suzie,4406,655,726,4278466167
y,@RedWhiteDrink,"Male Nurse
Beer, Liquor, America","Red, White, & Drunk",1879,653,914,2604750818
y,@HockeyGirlWendy,biologist/animal lover/scrub nurse/linguist/survivor/scientist/atheist/Blackhawks fan/feminist/Harley Quinn&HelloKitty/Happy Wife,Wendy Darling,18800,653,689,3297778964
y,@DaviesGill14,"Consultant Nurse (MH) NHS Highland passionate about mental health recovery,person-centred quality care/carers and education. RTs and fav my own.",Gillian Davies,1892,652,1463,2476502607
n,@BensonDeja,"__ 
Future Model 
Future Fashion Designer 
Future Nurse",Dej__,3975,652,1182,2923449627
n,@SassySNProbs,"Student Nurse following my passion for people, just trying to keep a straight face.","Jessi, SN",2638,652,318,2992652815
n,@Punc14Zena,2nd Year Student Nurse. For verification please visit: www. http://punc.org.uk. Plymouth University Nursing Cohort (PUNC) 2014. Academic account,@punc14zenah,153,651,1473,2801576451
y,@anamargame,I got lost but I'm found;) Nurse/Dentist at heart and soul 3 I'm nice so be nice :D Promise! :D,anamargarita,56,651,1215,4601039060
y,@TracyCarrillo15,"Registered Nurse, Proud American Conservative , Animal Lover",Tracy Carrillo,4614,650,1229,2468765156
y,@gaoutlander,Forensic Nurse and GA USA OUTLANDER FAN,GA Outlander,3767,650,344,3359157879
y,@babe_nurse,Charge Nurse. LPN to RN. Live to ride. Pierced and tattooed. Minnesota.,NursingBabe24,2635,649,616,2591858437
n,@suftgifsin,17 aos|Nurse Student Future Doctor ___| Good Vibez | Mexican,suftgifsin,17086,649,450,4130797159
n,@meiramiyuPACOS,_Live___Yamaguchi 15years old. _Dream ___Nurse _Instagram___http://Instagram.com/meira0801,MEIRA,98,649,179,4442367679
y,@MariaCarb65,"Dedicated Nurse and Mother. Proud Auntie of American Idol Winner Nick Fradiani. 
Member @nickfradianist",Maria Fradiani,5348,648,689,3094665707
y,@marathonmatron,"Mom, Wife, Nurse, Runner & Triathlete training for my first Ironman. Follow me to IM Mont Tremblant! http://www.facebook.com/marathonsmotivationandmultisport",Angela Campos,499,646,1026,3049444005
y,@ElinaWhitsett,"Life is for living, loving & sharing - banish fear! Veterinary Nurse, DJ, Singer, Artist, Tree Hugger, Book Worm & Film Lover. Believe in the magic of life!",ElinaWhitsett,64,643,1964,2482779391
y,@RA_Kitty21,Universitas Negeri Gorontalo _ S1 keperawatan #nurse,Riska Amelia ILoponu,1310,643,458,2839179129
y,@GraciousHealer,_Be your own anchor.__ __ TW | RP | Detailed. | Keeper of the Supernatural boys and friends. | Nurse. | [[My son: @UndauntedTruth.]],Melissa McCall.,2,643,271,3040387411
n,@dallaswhitesky,i just want my dreams to rescue me | | future nurse with impossible dreams| | XVIII __,whatdoyoumean,5760,641,1119,2562527312
n,@TheVetNurseJnl,"The Veterinary Nurse Journal is the leading independent, peer reviewed publication for vet nurses in the UK.",The Veterinary Nurse,55,641,945,3263943839
y,@nursec1994,"LPN. 21 years old. Liberal. Feminist. ProVax. Studying RN, BSN.",Nurse C.,645,640,414,2959097442
y,@fazel2015,nurse,fazel,1212,639,995,3194748515
y,@RNNightlife,"Nuke your Nightshift and Create the Life you Deserve!! Nurse-Preneur!. Attraction Marketer!! 
Grab your 5 Steps to Freedom below!!!
http://JanBrook.bizbuildermastery.net/",Jan Brook RN,78,638,1121,4709949691
n,@SweetHeartAd,"+2 student, Mummy ko piyari chori,My hobby is to became a nurse. I love travelling,singing,talking .. #live #love #laugh #friendshipforever :)",YoungGirl Sadikshya,288,637,672,3918142392
y,@Shabrina_lfc,a nurse | proud to be a muslimah | Liverpool | RidoNugrahaRahmadin | Consultant Jafra | 143 004 | #ynwa,Metty el-Shabrina,2416,635,579,2468971626
n,@johnjhayzie,"Be good to me I might be your Nurse someday.
ii|iv|mcmxcviii|",jhayzie castillo,8149,635,1625,2527393255
y,@VALEITE259,"Love animals & nature, rugby, cricket, history, fantasy, British Horror. If you're not keen on politics don't bother! Welsh. Nurse. Left of 'centre'. Stop TTIP!",Maria C,12232,635,778,2635807604
y,@kidsheroseries,"Clinical Psychologist & Author ~ Books for First Responders & Families (Police, Fire, Paramedic, Military, Nurse) ~ Stories & Workbooks for Heroes!",Dr. Susan Hunt,117,635,425,3269511896
n,@evergreenxqueen,Sassy College Student in the Evergreen State / Future Nurse / Coffee Addict / In Love With My Best Friend,Queen T___,3137,634,567,3104167729
y,@Nannette6988,"Living life & always learning. Mother, nurse & lover of coffee, beer, food & my man...Not necessarily in that order. #boise #nurse #relationships #lovetakeswork",Nan,2263,633,654,2421396602
n,@PristinHomecare,Pristine In-Home Care is a eldercare and childcare company owned and operated by a Registered Nurse ensuring the highest quality of care to individual's.,Pristine Home Care,91,633,700,2959640231
n,@Sassypsycho53,Luke 1:45. Talks a lot & laughs too much. Life begins after Coffee. Too much sass for you. future nurse.,Sassy Thick Chick,386,633,1478,3534304934
y,@saigebartel,2_2_. Emergency Medical Technician for Sinor EMS Flight nurse/Air Evac Lifeteam is my dream #SWOSU #fitnessislife SNAPCHAT@saaiiiggeee,Saige,2404,632,414,2482256124
n,@tastylacie,Naughty Little Nurse Selling Used Panties,Tasty Lacie,267,629,751,2578995799
y,@Healing_Nurse,Just a naughty nurse working in a hospital. {If you don't read my rules don't rp with me!} |Rp21+|Lesbian|,Nurse Joy,18,629,179,3023788348
y,@ChiefNurseNUH,,Chief Nurse NUH,30,628,52,3011908025
y,@traceyhardy789,Community Matron Long term conditions and tissue viability link nurse,Tracey Hardy,2878,626,952,2513880704
y,@fitnurse2014,23 years old - ICU nurse - getting healthy and learning to love life along the way,NursingFitness,580,626,1291,2743618069
n,@cutejany,24th March. Nurse-Attorney. Aries___,black barbie,1925,625,493,2534946623
y,@PJBeachey,"Love investing Favorite sector emerging #cannabis Industry. Enjoy serving others. Epicure. Nurse. Husband, Father.",Phil Beachey,4497,624,1022,2358999630
n,@StraightANurse,ICU RN with a passion for mentoring students and new nurses. Author of Nursing School Thrive Guide and http://www.straightanursingstudent.com.,Nurse Mo,972,624,171,2522903095
y,@sarahgenove24,Registered Dialysis Nurse | IV Therapist | AlDub/MaiDen/MaiChard fan __,SarahSam__AURORA,39413,623,356,3293805522
n,@alexandra_mh3,Future Nurse in Process. Taken.,Xandra,360,622,1823,2426633114
n,@xoxomissjess,Baylor graduate. Nurse in training,Jessica,13717,622,363,2825297696
y,@MaryJanePP1,Event in life happens in an opportunity || nurse/mum for life || Tatak LizQuen London Europe __,LizQuen 4mumz Uk,19172,622,186,3130622008
y,@SpottedTiger,Co-Owner of @RivalryEsports | Nurse | Streamer | Doesplay Admin | PSN: MissSpottedTiger  http://youtube.com/c/SpOtTeDTiGeR__ ______ @RivalryKnight ______,SpOtTeD,5073,621,832,2945625998
y,@livinglyf12,"I'm a diversed woman.optimist, genuinely loving & caring. God is good!  #nurse/doglover/saladlover/musiclover/fruitnut/traveller/risktaker",143Emmanuelle,360,621,1705,2989774982
y,@AdriannaBlaise,"I am one involved in the beauty of music, dance & art. I am a mother & grandmother. I am a psychiatric nurse.   I Am Second.",AdriannaBlaise,76,620,1693,2482449332
n,@NurseResidency,Let us help you find your first nursing job!,Nurse Residency,455,620,6,2505326335
y,@JonScattergood,"Mental Health Nurse all my working life, You'll always need us! Rock music rules! Comments and views are my own.",Jon Scattergood,4073,620,801,2637984994
y,@MissMaldanoxo,21.Aspiring Nurse. Sister of @LittleHamiltonA Big time wrestling fan.. I'm a runner and a swimmer. I love sports and fashion.,Michelle,214,620,984,2990445213
y,@lauraevelynbee,"Mama to two gorgeous girls, paediatric nurse,  
health visitor. Blogging my way through motherhood, beauty, fashion, travels & life.",Laura Evelyn Bee,1418,619,511,2492719579
n,@enRICHment__,"ANW
Taking the road less traveled by to get places few people have gone before. 
Joshua 1:9 #Nurse #Actor #OU17",.,8496,618,829,3235896051
y,@KCLSU_vpeh,Vice President for Education (Health) @KCLSU. Mental Health Nurse. Tweets are my own.,Sophia,1262,617,465,2729477106
y,@Ald0willl,on a mission to educate and change the medical system #usa #world #equality #medicalreform #washingtonDC #education #nurse #tech #corruption #mentalhealth,aldorin williams,507,617,2078,4866119375
y,@nurse_chatter,#NurseChatter__ because #NursesMatter,nurse chatter,84,616,1990,3875447656
y,@RSCH_RespNurses,Team of Resp Nurse Specialists based in both secondary & primary care.Passionate about delivering high quality respiratory care.All views are our own.,RespNurseTeam,546,615,384,2859735379
