class,screen_name,description,name,statuses_count,followers_count,friends_count,ID
y,@LifeAsWeNurseIt,"just getting started in the RN, BSN world - night shift float pool - experiencing a little bit of everything and trying to find some humor along the way",Life As We Nurse It,85,612,289,3314544873
n,@sexayy__,"19years young , future nurse , college student",sc:liyahhmarie,4188,611,756,2386165704
n,@iloveon84000179,"My neck,my back,my netflix and my snacks   | _Future Nurse_  |                                            http://MMSadiwa.COM",Matty Acejas Sadiwa___,1329,611,1883,2401399190
y,@Chritty77,"love my girls, ufc, country music and my family! #ufc#countrygirl #fibro #hunting #nurse #smalltownliving",Christy,4438,611,1108,2405293166
y,@Hell_Kitten4,"North Carolina born and raised,Happy mother of four, love my cat and my man, Nurse, Army Veteran.",Giselle Espinosa,83,611,1476,2502303515
y,@moniquehenry15,"Woman of God. Life Success Coach. Motivational Speaker. Registered Nurse. Medical Student. Mom of 6 chickypoohs. CEO of Renewed View Coaching Services, LLC.","Monique Henry, RN",301,611,522,3063910196
y,@BOwensRN89,"Author, Nurse, Inventor, Chairman, Aneurysm Survivor, Husband-to-be, Member for RN Discipline Reform Movement","Brandon Owens, RN",49,611,1964,3116641304
n,@ameliamaryx,Beauty & Lifestyle Blogger | Reading & Baking Enthusiast | 2nd Year Student Nurse__#thegirlgang ameliamaryx@gmail.com,Amelia Larsen,1382,610,435,3423869673
y,@dadahamac,ofw/nurse/jadinefan/wljd member/domo fan/cartoon addict/loves pink/i __james reid/i __ nadine lustre,i __ jadine,3288,609,1065,2869138514
y,@SaraBaduria,Follower of Jesus Christ / Married / Conservative Republican / #Cruz2016  / #NHLDucksfan / Nurse / lover of NYC and San Clemente Beach,Sara,1307,609,636,2879873850
y,@meanimemean,"full time Mainenatics,  part time Nurse",Mean/Mayang,3559,608,105,2491839180
y,@ChrystineShaw,"Retired nurse, love all critters.  I am at that stage in life where I think I will kick my heels up and just die laughing at life.",Chrystine M Shaw,767,608,1963,2890065408
y,@nurse4lyf73,"I AM A NURSE.  Folgers, lots of Folgers! Wicked sense of humor.  Music makes things all right, once it hits U, U feel no pain. Make ur life better or not, ^2U",Sheila Jo,2636,608,2454,4719950390
y,@tanasia_thomas,"Author, Wife, Mother, Teacher, Nurse, Blogger, Inspirational Woman, Follower of Christ.  #SisterPepTalk Movement",AuthorTanasia Thomas,5699,605,568,2581121648
y,@madrigaljulian2,NURSE,Julian Madrigal,2621,605,681,3229936023
y,@andrenigel07,"Nurse, Cake, Biscuits, MH, NE, est 1970 - lying on the floor in the kitchen listening to the radio",__Nigel  Andre __,4568,603,1440,2894974726
y,@TheGayNurse_,"CCRN, Asshole, Gay. I drink vodka and bitch a lot. Avi is me.",Gay Nurse,4079,601,158,3034993179
y,@CaseyDumont,"Westfield Matildas, Sydney FC, Registered Nurse, Animal Lover",Casey Dumont,428,600,214,2478307429
y,@zenkristel,Former LSian__ | Student Nurse |,HEY!zen__,3836,600,1495,2526434468
y,@Onlii4aBoss,#GOD and Family!!!  #Queen unlike the others  #Nurse Takes NO bs,Letece Renee,1236,600,1059,2728808349
n,@jaxiebella,"Intensive Care Unit, Trauma and Open Heart Surgery Recovery, Cardiac Monitor Tech. Loves God. USMC Wife. Registered Nurse Student.",Rubi,3766,600,578,2812674753
n,@LilIowaGirl,Iowa farm girl. Chevy trucks. Cattle barns. Gravel Roads. Future Nurse. #BGNation,M From Iowa,1929,600,460,2952724002
n,@roninicolee,"_KcKcc student_ Court is queen :) _ Your future nurse in the making_Animal lover_ I'm dreaming on a beach _ {Stay humble, homies}",_C__OC__O_,4046,600,448,3085443898
n,@Tr2ck_Baby,God First__ Track and Field.... Future Nurse Practitioner.... Christian S.__ 01.05.16,Accura_,1413,599,894,2444780937
y,@screvmom,"Wife, Nurse and Bama Fan!",RN4Bama,1573,599,1661,3062326842
n,@BawseySnob_,Future Nurse. 22. snapchat: kings_muva. instagram: _bawsey_,Princess Lena,14921,596,365,2427816943
y,@sarahjaynewrts,"Nurse and a writer daring to follow her dream of becoming a full-time author. I especially love poetry, inspiration, humor, and scifi/fantasy.",Sarah-Jayne Iglehart,83,596,735,3239464237
n,@RinascitaVitaYT,"fearless, feisty, ferociously pissed-off  conservative patriot beotch. fighting to save my God and Country.  GenX, 
Nurse, USAF Vet. I like guns.",RinascitaVita,732,596,824,3355967475
y,@davinashacklet2,Linda Andrew//nurse at holby ED//single & looking // best friend is Zoe//massive Christine tremarco fan//RP//,Linda Andrews,13498,595,972,3078473640
y,@KarkiAachal,"________ PROUD  to Be a NURSe____
Being different isn't a bad thing.
it means I'm barve enough to be myself.",Aachal foreva ____,1499,593,1011,4133614333
n,@iamloolaloo,| published photographer | ex model | ex AP girl | soon-to-be A&E nurse |,ali lo,1717,592,1991,2498803190
y,@RNDeandreBASS,"Pansexual. Nurse. Makeup Artist. Chef. Drag Queen. Singer. Writer. I love music, tattoos and sleep. Snapchat: theonlydeandre. Instagram: Deandrebass",Andrs Castell_n,896,592,909,2788891958
y,@artgrljan,"true southern woman, who loves the heat, sun, beach, boots, bracelets, dogs, a great glass of wine. Hotty Totty for SE C football. Nurse an Artist.",Jan Mardis,363,591,2151,2770724451
y,@stanner1025,"Wife, mother of 3, nurse with degrees in soc/poli sci, strong conservative woman, repentant former liberal,  Midwest born, Southern girl at heart.",vicious ginger,1298,590,1164,2602762526
n,@intanshafenaa,Intan Shafena | 1995 | Kedah | Student Nurse,MiSs FieyNa,3264,588,561,2910503130
y,@nursebromo1,24. Full-time Nurse. Full-time Student. Future Neonatal Nurse Practitioner. Fitness. Tattooed. Bearded. avi is me,boom,971,588,699,3285769957
y,@Breathless_Bird,Im an ex ballet dancer with a mad rare bendy condition. A nurse who works stupid shifts. Motorsport floozie.. can't be bothered with DMs,Lonely Heart,5643,587,242,2754553793
n,@studentnurse16,"Ramblings from the life of a student nurse, girlfriend, best friend, daughter, sister, admin manager, marketing assistant, freelancer and crazy person!",Student Nurse,61,587,1075,2908851504
n,@jakol6969,"Just give me your best shot. ( Sucker , Bottom , Oral and Anal sex baby) #Jakol",Nurse bottom,1271,586,627,2439205939
y,@rad_elizabeth,"SC: totallyradliz | dont wish for it, WORK for it | aspiring nurse | University of Colorado Colorado Springs | 071815 @mistersleaz __",gonzalez.__,17748,585,268,2415317976
n,@WhiteBBCSlut,"I make it my life's goal to make sure every fat Pokmon cock is drained of its cum, preferably inside me. #OPENDMS TO BBC + PKMN Beware: N-Words ahead",Nurse Joy,68,585,140,3244564867
n,@Nursenance9,True believer in human kindness. Try to find humor in the least expected places. Love challenging my beliefs.,Nurse Nancy,17396,584,466,2612835006
n,@keiraaaaa__,Student Nurse,Keira Thorne,5120,583,527,2358633437
y,@MelanieMallari4,Nurse from Cali! Proud & Forever fan of ALDUB/MAIDEN __LOVE IS FAITH,SOLID AL__DUB CALI,43175,583,1101,3694222224
y,@WieseSylvia,"Sydney born, 55yo,BAppSc.Retired reg. nurse(30yrs).Patriotic Australian.Lover&fierce defender of our allies and Western civilization.",SylviaWiese,3169,582,837,2766928304
n,@Susan_Mktg,"director of marketing & business development @horizonprimary. advocate for hollistic, preventative health and nurse practitioner care. opinions are my own.",Susan Bergman,284,582,1072,2902385019
y,@SweetJesusGirls,"Jesus loving wife, mom, nurse, and creator of Sweet Jesus Ministries. http://facebook.com/sweetjesusgirls",SweetJesusMinistries,418,582,771,3167606525
y,@MHWarriorUK,"MH Liaison Nurse/MH blogger/MH Warrior, Admin for 'Man Up Let's Talk Mental Health' #mensmentalhealth #mentalhealth #wellbeing",MH Warrior,1145,581,647,2935347005
y,@nicolelimqueHP,adamsonian. vincentian nurse.,nicole limque.,7662,580,332,2390857171
n,@CalMidwives,The California Nurse-Midwives Association (CNMA) is the official California state affiliate of  the American College of Nurse-Midwives.,CA Nurse-Midwives,3688,578,687,2513867635
n,@hellonursemed,"An innovative system that automatically combines fall management, pressure sore and skin breakdown prevention with incontinence monitoring.",Hello Nurse,1795,578,591,2902990948
n,@lilly_lovin,Lover of all things Lilly Pulitzer and preppy _ Boston girl _ Future Nurse,Lilly Lovin',463,578,1207,3363573323
y,@a_alexis21,Single momma. Blessed. Ambition. Nurse. mwuah!!,LenAh ;),1052,577,1192,2419234782
n,@northwestwife,In love with my best friend since 2010. Future Nurse. Learning to love Virginia. Avi is me.,Red White & Darling,1703,577,516,2818507800
y,@LisaAnnSpringer,"nature lover/ adventure seeker/ book worm/ Registered Nurse/ 28/ advocate for eating disorder awareness, research & education #IEDAction",Lisa Springer,4026,576,490,2398588146
y,@iamsuper_emak,Nurse - Selfie King - IG: iamsuper_emak - FB: emak.romasanta,Emak Romasanta,1180,576,399,2666626868
n,@sassylauRN,"Nursing student. Lover of donuts, puppies and selfies. Very sassy and very cute. Not a nurse so don't ask me to look at anything on your body.",KS Future BSN,2868,575,400,2579210265
y,@HeyyNurse,"Cat lady by day, ER nurse by night...",ERNursey,199,575,52,2623734513
n,@bowsandpearls12,future nurse even though I smoke too much weed,bows and pearls,1772,575,239,2655364244
n,@Marrri_oxo,young & reckless. cali livin._ future USF graduate & nurse. reaching one goal at a time. insta:marrr_oxo snapchat: mahrii_oxox,Mahrianna,3131,575,514,2966045439
y,@SarahH81x,"Don't follow me, I'm really boring. Nurse.",Sarah,43,575,1224,2996483407
y,@pds111183,"Mother, nurse, sister,friend, runner, music lover and lover of life!!",P Stanley,5117,575,752,3140885182
n,@ItsChapmann,20 years old. NASA/USPA Powerlifting. Future Nurse Anesthetist. Dedicated Christian. @maddie_smith97,Matt Chapman,537,574,953,2744609489
y,@Doit4thebootyy,23 | CT | Registered Nurse | 060108,Just Do It,520,573,748,2474905724
y,@maymarjorienilo,nurse-workingmommy-blogger,May__fg,10065,571,150,2847440671
y,@Prolifefriend,"Husband , father and grandfather. Retired psychiatric nurse. Author of book The House Behind the Trees. Poems for the Aborted Child. Catholic.",Doug Abell,185,571,1347,2867810823
n,@KarmaNursing,"With Karma you will benefit from our extensive experience in nurse staffing, but also the superior technology we utilize to meet your goals. #NurseJobs",Karma Nursing,176,571,271,3385956953
n,@babydollRICH_,future nurse(; fuck it! I live without regret...,fanii____,2578,570,1257,2730836255
y,@gmaildotorg,"37 year old NY state Nurse. Author (http://lulu.com), musician ( clarinet, voice, piano, sax, trumpet, guitar) daughter Lillian Nichole 14.",Christine MB Green,1964,567,1845,2750658929
n,@Alida_Franches,Nurse Assistant|CPR-AED-FA|Writing Tutor|Professional Writing|Leadership,Alida F. Timmons,2050,564,849,2842737352
n,@FeelinMeJonzey,"BTW '14
Future Neonatal Nurse
SC:  kween_jadiee
IG: shawtyjay___",JAY..,964,563,1273,2507549388
n,@LeahMichelle301,C/o 2016 | SC: Leah_michelle21 | Rule #1_ Never be #2_ #Future Nurse | RIP my angel 8-13-15 | 6/5/2013 __,__Dimples__,2765,563,501,2740111537
n,@CatGobeil,botox injections in Longueuil / Boucherville Catherine is known for her professionalism and respected as an experienced TOP nurse injector. 450-468-9999.,Catherine Gobeil,256,563,59,2775622782
y,@SThijzen,Nurse in Elders Home Proud grandmother of five,Sandra S Thijzen,137,562,1862,2740895546
y,@Nursingmoments,"Moments that made an imprint on my mind, heart, or soul. A simple reminder to stay humble, grateful, and mindful.#nurse #nursing #emergency",Moments in Nursing,582,562,877,3011441168
y,@CannaHeatheRN,,Nurse Heather,312,561,629,2457152527
n,@lexie1487,"28 
Nurse / model /author/mother.........
I'm me if u don't like it I don't care 
If  u following me Plz like Pics and Comment  I'll do the same.__ #TrxllGXDS",mizz badass,528,561,2079,2657454019
y,@celinebeaut1,"Hey celine here, I am a very hardwroking nurse at Dee valley hospital",celine mcqueen,567,561,820,2884125717
y,@maggieclarkelpt,"Professional Lead for School Nurses for Leicester, Leicestershire and Rutland. Queens Nurse. Part of the weschoolnurses team.",maggie clarke,3608,558,265,2474655261
y,@AnnaKrosp,"Lived in Ky all my life, married 25 years. I have four children, nurse of 20 years, trying to enjoy life God has given me",MariaWarren Krosp,355,557,1784,2400934775
y,@bearcunningham,"Proud Cunningham. Div1 Nurse, rep MoodyRacing, @claresfancies __",Clare,187,557,149,2794879394
y,@HeadRNColumbia,Mom. Nurse. Leader. On #1 team in NY - NewYork-Prebyterian. Chief Nursing Officer at Columbia University Medical Center. I love ER & trauma. Tweets are my own.,Courtney Vose,2659,557,386,2888961875
n,@LewdVaporeon,Kaori a cute little Vaporeon!~ I have a family! :3 #LewdEeveelutions Um Battle me if you want! I'm very strong!,Nurse Kaori,361,556,285,2708569710
y,@nursehumor_,nurse humor,Moriah,15,556,523,4167312207
y,@kath_leech,"Mental Health Nurse. I like heavy metal,horror films,crime books,Radio 4 Extra,Criminal Minds & CATS!  Home to Mouse,Scampi,Paws McGraw,Spud & Poppy the bunny.",Kath Leech,8382,555,781,2962152119
y,@helenllowe,"Magicians Daughter #FredLoweMagic. Mother, Nurse/Midwife. Author of 'Hartmann: Malicious Rules', a spine-chilling crime thriller, & a journey to BDSM hell",Helen L Lowe,75,553,1316,2381044640
n,@_Max_Walker,A humble porter at Holby City ED! Step-brother to nurse Robyn and engaged to a consultant,Max Walker,51711,552,380,2569711834
y,@nurselife_,25. Nurse (duh).  Canadian (eh). Eat a lot. Laugh a lot. Sarcastic 97% of the time.,Nurse Life,904,551,161,2412912462
y,@tim_oconn,@tim_oconn I am a #nurse #researcher interested in #chronicpain .Love #networking and #collaborating with other #researchers and #academics.,Tim O Connor,1085,551,2124,3025148655
n,@CourtneyShante1,"boots, booze & boys with tattoos || future nurse||",courtney,481,549,1077,3041302954
y,@EmpowHerHealth,"Empowering Women to Superior Health & Wellness!!! Registered Nurse Mompreneur, Holistic Pregnancy, Birth & Postpartum Advocate, Health Coach & Life Changer!!!",Jessica Strong,365,548,1058,3157622811
y,@Jam3sPJ,Registered Nurse. Principal Lecturer. Doctoral Student. Astronaut. Model. Racing Car Driver. Liar. All views are my own.,James PearsonJenkins,4981,547,553,2811365886
n,@brooklinbeautyy,future nurse,B,1952,547,916,3294011489
y,@healthyfit_sea,Registered Nurse  My goal in life is to motivate people to live a healthier lifestyle. Follow mee to hear my thoughts & ideas,healthy_n_fit,487,545,490,2884296268
y,@NurseBloodyVal,"The Ninja Nurse and sole survivor of lab 7, now working for the Skullgirl... or is she? (Lewd/Non, Detailed and Experienced. Normally Futa can be Fem)",Nurse Valentine,857,545,403,4093003954
y,@Billy9711,father grandfather husband retired firefighter and OR scrub nurse. Now disabled so we are starting our other passion. Gun smithing so welcome and enjoy our site,VanDeven Gun Smith,3834,544,1012,2611161752
n,@USArmyGrlfriend,"A Pinterest fanatic, Nurse-to-be, U.S. Army Girlfriend. Love my Ukrainian-soon-to-be-American-Man. Etsy Shop __ PlethoraOPearls. My __ is in GA.",Amanda,2224,544,289,3010532006
y,@KatherineVgt,"Wife & Mom of two. Nurse.
Nature lover & dogs & animals & architecture.
I really believe the world need more.",Katherine Vogt,408,544,1123,4861895304
y,@Menphysc2gether,Where Mental and Physical Health Fight Together #Air Force veteran #nurse http://facebook.com/pages/Fight-Cl...,Fight Club LLC,1177,543,1965,2982040277
y,@bigsisterhouse,"Make Small Healthy changes, Interest in Health promotion Ex Clinical Research Nurse, Love Good Food, Diets dont work, Make it fun, Life is for Living",kathrynmcnaught,3241,542,954,2397213423
y,@alittlelondoner,"Nurse,mummy,parent/baby blogger Amelia Rose and Harry. Winging my way through parenthood along with husband",alittlelondoner,1610,542,480,2405813207
y,@ShoulderTo,"I am a mom, wife, nurse, Christian, peacemaker; friend2=friendless. I love to make people laugh, :-), Ive been there; can help others or just be your friend!",A Shoulder to cry on,1214,542,938,2493387611
n,@KaitlynnMadden,"My name is Kaitlyn, I am from Bowdon, Georgia. I am 20 years old. My favorite band is Attila. I will be a Certified Registered Nurse Anesthetists by 2019!",Kaitlyn Madden,152,542,1655,2684526985
y,@wilvz04,"Im a Nurse, Capsunian , Nurse since 2011, Love yourself,enough to let go of All the TOXIC: Lovers, Friends, Food and Thoughts BE POSITIVE AS MUCH AS YOU CAN.",Wil Wil Wil,6348,541,743,4177461015
n,@HugYourNurses,,Hug Your Nurse,94,540,530,2929183152
n,@NeuvooNurSD,Check out our Nursing jobs in San Diego on our website http://neuvoo.com/jobs/?k=nurse&l=San+Diego%2C+CA%2C+United+States&f=&p=1&r=15,Nursing San Diego,12832,540,1602,3240572254
n,@nada_sani,"Akademi Keperawatan PEMDA Sumba Barat | Waikabubak 
I'm a NURSE !
Mention for follback :)",Nada Sani,444,539,1245,2536264737
n,@XXXkendraCam,"Asian, cam model, +18 hot girls, big busted wanna squeeze it?",Nurse Kendra,525,539,1427,4036843108
y,@AngiyMichael22,A&E Nurse . Previous incarnation as an Emergency Medicine Research Nurse All views are my own .Re-tweets do not necessarily mean endorsement.,Angiy Michael,1302,538,1642,2918885481
y,@hsmounce,19 years old; tennessee; nurse; i love Jesus; __,#NAME?,75,538,1747,2945153703
y,@Lori_Slocum,"Mom of two, nurse at Eastar Health System & Fundamentalist!",Lori Slocum,109,538,384,2986165567
n,@JEAJobs,"25 + years of exp in Healthcare Recruitmen
Physicians, Physician Assistants, Nurse  Practitioners, Physical, Occupational and Speech Therapists, Staff Nurses,",Frances Wiernusz,7513,537,817,2377701324
y,@maryelang,"I am a wife, mother, burned-out nurse and published author.",Mary,137,537,750,2549128218
y,@DavidAinsNHS,CCG Director of Primary Care; Advanced Nurse Practitioner; Heath advice to celebs/sporting stars. Passionate about the NHS. Views are my own.,David Ainsworth,1760,537,448,2558771055
y,@eman4salah1992,palestanian..... live in Jordan..... Nurse  ^_^,Amoon Salah,222,537,718,2710385486
y,@RamonaSuperfici,"Semi retired nurse, newly married, baker, food enthusiast, freelance writer, stay at home wife when home, world traveler.",Ramona Superficial,325,536,1142,2418169423
n,@GeorgianMess,In love. Future nurse. Christian. Football addict. _.,Queen,1950,536,127,2883303635
y,@_bbrreeee_,future registered nurse _ #LSU19 sc:bbrree6,brittneyy__,11079,536,394,2919789162
y,@naturalserendi3,Registered Nurse/Aromatherapy,Natural Serendipity,206,536,789,4550453293
y,@Leslie_Blount,"I'm an Alabama girl, critical care nurse, wife & mom. I love country music and The Crimson Tide. Roll Tide Roll!",Leslie Blount,935,534,1055,2883081999
y,@Alyssa122690,_BSN _Private Nurse _Work hard. Play hard ___LovesJM,Alyssa,476,532,1504,3075307231
n,@coleleigh3000,"pansexual trans guy | studying to be a nurse practitioner with a focus in mental health and psychiatry | loves art, music, and nature | He/Him",Cole Leigh,194,532,1016,4324122736
y,@cherhubsher,__NHL Cheerleader|Registered Nurse__|Aspiring Actress| My Super Sweet 16|MTV's Exiled|MTV 'Most Wanted'|Mrs. Tampa Bay 2015,Cher Hubsher,430,530,651,2969082873
y,@renurture,Cosmetic Nurse Inhector,Heather J.,15,530,1709,3271124346
y,@ccnairforce,Small town girl going worldwide with the United States Air Force|Doing what I love| Medevac Nurse| Doing the impossible everyday| Baby anon| #flyfightwin,CowgirlinCombatboots,272,530,964,3350688184
y,@knifehat1,"Unemployed Nurse, loves puppies, kitties and butterflies, Part time Redneck, part time racial profiler, all Pink Floyd Fan, play with my Steely Dan, All Dude.",Knifehat,634,529,1784,2559465793
n,@surabooks,"Sura Books - Leading online competitive exam books for tnpsc group, trb pg, rrb staff nurse, bank, tancet, bsnl jao & other exam study material buy online now.",sura book,2197,529,500,2922322986
n,@Anna_m_Edwards,Nottingham Nurse-leading on revalidation & shared governance. Occasional baker & knitter and caught the travel bug. Instagram- Anniexx28,Anna Edwards,1404,528,768,2606688399
n,@seethenp,SeeThe NP provides evidence based medical and wellness education which is developed by Nurse Practitioners.,SeetheNP,217,527,148,3290129654
n,@RnToday1,"http://Www.ParentalAlienation.simplesite.com
REGISTERED NURSE TURNED ACTIVIST
HUMAN AND CIVIL RIGHTS
THROUGH AND FOR GOD'S GLORY",MelissaYOwens,5311,527,2093,3596165892
n,@nagsusa,"Where Women Meet Weapons Empowering Women : Advancing Freedom through Personal Security, Safety, and Sovereignty.",Nurse & Gun Society,84,527,1561,3917205025
y,@janbhess,Advanced Registered Nurse Practitioner who is politically active in trying to improve access to health care by removing barriers to NP practice.,Janice Hess,3547,526,783,2435757688
n,@gala_crna,GALA is a social group of LGBT Nurse Anesthetists. We foster a positive & supportive environment & provide educational scholarships for our anesthesia students.,GALA CRNA,2960,526,534,3281170910
n,@EDnurserants,tales & rants from a ED nurse,ED Nurse Rants,347,526,723,3319747414
n,@__oohNaNa,future pediatric nurse __ fearing Allah ____ : na-ja : success __,Ms. 19 __,8384,525,461,2508031729
y,@Ludy_Asher,Registered Nurse and Midwife | Crazy | Lover | FANGIRL: @JustSarahG #AshMatt __ IG: ludygurl http://facebook.com/ludhiii http://ludygurl0502.vsco.co,Ludy Florentino __,4284,525,1637,2582155261
y,@JaysGordon,Mom|Wife|Nurse|New Blogger|Bama Football|ATL Braves|Dark Chocolate & Coffee Lover|Wanna Be Writer|Pink|Country Music|British TV Shows|Bama Girl Living In OKC,Jays Gordon,646,524,1338,2790384728
n,@no1offers_tees,"Shop graphic tees by category including dogs, cats, fishing, tattoo, nerd, nurse, hunting, christian, sport and more!",Awesome Tee Designs,456,524,1998,3394600095
y,@thatloudRN,"RN. I have a lot of tattoos and I curse even more. New to the ER, trying to save a life. #nightshift #KCCO #RNtoBSN then FNP starts in 2016 Avi is me",Im that Nurse,556,523,314,3222625722
y,@henry33tan,Henry Tan is a private nurse who also likes sports events. He is very passionate with his work as he loves taking care of other people.,Henry Tan,91045,523,40,3254414976
n,@NecrotizinFlesh,"-MAJOR Rob Ford supporter
-IOS Hacker/ Icloud X
-Rn: Registered Nurse Graduated from College of Psychologists of New York 1993",Dr. Donald Higgs,148,522,1833,2672999792
y,@BlockTherapyRN,Registered Nurse & Certified Block Therapy Instructor at Fluid Isometrics. Discover our life-changing body work practice.,Shelley Elhatton,810,522,1035,2841446241
y,@TheHappyFatKid,SELF LOVE. Lasallian. Registered Nurse. Optimistic. Gullible. Drama Queen. IG: @dramaqueensimon,Simon Cabrera,4229,521,254,2819705239
y,@thorntongillia1,Retired nurse. Buddhist. Love EDM. Especially drum and bass. Very family oriented.,Gillian Thornton,1988,521,1017,2919914897
n,@TeamCarliNorris,"Twitter support page fot Actress Carli Norris, probably best known for playing Martha in Hollyoaks but recently cast in Holby City as Nurse Fran Reynolds.",Carli Norris,1,521,7,3094994842
n,@ThatPedsMurse,"I'd rather be elbow deep in kid shit than adults. You even nurse, bruh? These are my opinions and dont reflect my employer. Talk baseball to me",PedsRn,1214,521,637,3299491403
y,@melkaterupp,"Marathoner, Nurse, UF Grad. and Mom.   #MarathonPitStop #GoT #Nightwatch #TWD. Be careful what you say to me;  my best friend is a sniper. @snipercop21",Mel Kate,1438,520,721,2358705680
y,@ReeemAlharthi,"Life is hard, but no one said you had to go through it alone. There is always Allah to help you get through life ..Student at KAU..Nurse",___ ________,641,520,541,2795866040
n,@CarleeGrantham,"19, Jesus Lover, UHS Alumni, Employed. KPop lover. Gemini ___ Philippians 4:13, Jeremiah 29:11. Science lover. Military lover. Future Navy Nurse.",Carlee Grantham,2541,520,1133,4105829361
n,@KittenishChan,"26/F A fun-sized nurse and a sexy little kitten who loves all things ecchi 
NSFW 18+",__d____ _________ ______,4314,519,2,2530195238
n,@BREADSTIXRYUM,Hi I'm Nurse Compa! Here to help out with your Booboos and stuff!! Especially Neppy! She gets hurt A LOT! @thebeaterhero,__COMPA__,2160,519,768,2804360911
y,@NNUBonnie,Assoc. Executive Director of @NationalNurses & Director of @RNRNurses I am a registered nurse and healthcare champion who believes healthcare is a human right!,Bonnie Castillo,675,519,749,3506130508
n,@nursecierra,"Poshmark Queen 130K+ followers! _ Future Nurse, SIUC/SIUE _ Shop my closet link in bio",Cierra Motley,824,519,1509,3692129188
y,@LeMesaSStMary1,Self made Entrepreneur|Nurse|Manager|Writer|inspiring Actress on the rise...& mother wit! All Business Inquiries|oneonone1@mail.com,Le'Mesa S. St.Mary,897,518,665,3252909326
y,@cloverleafchron,"Mom of 6, author, nurse, educator, lover of coffee, a warm fire and a good book. Dreamer, idealist and a firm believer in everything happens for a reason.",E.V. Jones,1686,517,751,2794339938
y,@claire_ALN,Learning Disability Acute Liaison and Health Facilitation Nurse for CWPT,Claire Geary,708,517,1176,3047026506
n,@tim_redchupka,"freelance illustrator, painter, comic book artist and storyboard artist. Oh, and graduate nurse too.  redchupka@aol.com.",Tim Chupka art,63,517,1166,3128864593
n,@SassyAle_XO,___ Future nurse _ 24 _ Overly emotional _ Gaming is my life _ CAT LOVER ____ [#RuneScape @ Miss Honeyy__]___,Alejandra. __,1297,516,1720,2900029944
n,@wadznapuntukan,new acct (@pilyangkyuting - first account (hacked) - student nurse,kuting,15319,515,433,3106149409
y,@stanwhitt1,"Chair Florida Association of Nurse Practitioners, ARNP, Rural Healthcare Provider",Stan Whittaker,5157,514,857,2612404884
n,@OhGoshIts_Tash,future nurse... if i can make it through college,Tosh,3054,512,603,2530202630
n,@bethiyotte,Nurse Assistant __ _ Native American / French __,bethany iytte,12391,512,456,2911988958
